title,rating,author,date_published,review_text,Type Of Traveller,Seat Type,Route,Date Flown,Recommended,Aircraft
"""the cabin crew were great""",5,Ally Wharton,22nd June 2019,"✅ Trip Verified |  Istanbul to London. My first flight in Economy is the new A321 Neo, The aircraft is set up with the first 15 rows of regular seats and the remaining 17 rows of the new extra slim economy seats. The seat does not recline, is very thin and OK for an hour flight. However 3 hours 45 minutes flight it became pretty uncomfortable after 2 hours. The 5 members of the cabin crew were great serving the usual MS for sale products.",Solo Leisure,Economy Class,Tel Aviv to New York via London,June 2019,no,Boeing 777 / 747
"""I might fly them again""",5,T Reid,7th June 2019,"✅ Trip Verified |  Belfast City to Atlanta via London Heathrow T5. Check-in was fairly smooth at Belfast as it was early in the morning. However, when the agent called me over the check me in, he was all flustered that I wasn't an elite Executive Club member although my boyfriend had just checked in with the same agent without any difficulty. I knew he was working the premium line, but nobody was standing in it, and I was standing in the regular line when he called me. After about 20 minutes, I finally got a boarding pass to go through security. The flight from BHD to LHR was uneventful and bare-bones, as nothing was served for free on the flight. My boyfriend therefore hated it, as we're used to getting better service on American in the US, but I was fully aware that BA had turned itself into a glorified EasyJet. Once we arrived to LHR, I continued by myself to Atlanta on BA and was shocked at the crowded, user-unfriendly T5. Although I suppose it was pretty in some ways, I had to sit in one of the dank cattle pits they hold people in until their flight is called, so it felt very crowded and hot. After my flight was called, I found myself on a crowded shuttle to the plane with pushy people. Boarding was straightforward, however, and the flight attendants were very polite and helpful to customers, even in economy. The flight product was just OK in my view. I had an exit row aisle seat, and while I had extra room and a nice headrest, the seat was right by the lav, so it stank. IFE was fine with a decent selection, but it was not as complete as Delta's. The food was the bland equivalent of what Delta serves, so no brownie points there, and the ""tea"" service they had was terrible: we were given half-sandwiches in plastic wrap without a tray and then only with a limited selection of beverages. I remember years ago when BA was a premium carrier and served very nice things to its passengers with a friendly smile. Those smiles have disappeared for the most part, and the feeling of flying a special carrier is no longer there. However, I arrived on time and promptly got my bag. The 777 was also nice and spacious and the flight attendants were polite, so I might fly them again, though I would not recommend BA due to the crowds and discomfort I experienced at T5.",Couple Leisure,Economy Class,London Heathrow to Dubai,May 2019,no,B747-400 in retro
"""service went from good to superb""",10,Susan Holder,30th May 2019,"Not Verified |  London to Seattle. My husband and I have used this service for a number of years as our son lives in America. We have always been very satisfied with the service. Unfortunately I was taken ill on this flight and the service went from good to superb! I’d like to thank the cabin crew and Captain for the care I received during the last two hours of the flight. Advice was sought via radio, I was made comfortable in the galley, at least one crew member with me at all times, given oxygen etc. paramedic boarded the plane and escorted me off when I was then given a thorough medical check, a wheel chair was waiting and we were fast tracked through customs as I was not well enough to walk to the car park. We met the crew at the lift and the captain came to ask how I was. Many thanks to all of the and apologies to passengers that I must have disturbed.",Solo Leisure,Business Class,Heathrow to Singapore,May 2019,no,Boeing 777-200
"""an hour or so to drop off luggage""",3,Michael van Eimeren,23rd May 2019,"✅ Trip Verified |  Flight was OK, minor delay didn't both me. What was astonishing is that we had to wait an hour or so to drop off our luggage because at Lyon Airport they were training new ground staff at the same time? They continued doing this even though the cue became pretty huge and time started to run out to make it to the flight.",Business,Business Class,Gatwick to Dubrovnik,May 2019,no,A319
"""was very disappointed""",1,B Liddle,11th May 2019,"✅ Trip Verified |  I paid an extra £500 for two Premium economy seats on this long haul flight and was very disappointed. The seat felt small and was shabby, the tv screen was small and very dark. I tried to adjust it but it was still unwatchable. The whole experience was very poor, not Premium in any way. The return flight was a code share with Japan Airines which was Premium, a whole different experience. I would be happy to pay for their Premium seats. I would advise avoid British Airways Premium economy as it is far from Premium. I felt a complete waste of £500.",Couple Leisure,Economy Class,Bucharest to London,April 2019,no,Boeing 777-200
"""impeccable, attentive and delightful""",10,Susan Peal,1st May 2019,"✅ Trip Verified |  London to Calgary. Thank you to James, a Club World flight attendant on BA 0103 April 15, 2019. His service was impeccable, attentive and delightful. I thoroughly enjoyed the flight.",Business,Business Class,London to Seattle,April 2019,no,Boeing 747-400
"""Flight was good""",10,E Smyth,18th April 2019,"✅ Trip Verified |  London to Gibraltar. Check in at T3 was fine, lounge was good and staff were more proactive than was previously the case. Flight was good with decent lunch served including the kids meals which were fine. Skilled landing in Gibraltar- a good flight",Couple Leisure,Economy Class,St Lucia to Gatwick,April 2019,no,777
"""had to have a middle seat""",1,H Bayley,10th April 2019,"✅ Trip Verified |  Chicago to London. Cancelled flights just a few hours before I left home, then put me on a different flight which would have made it impossible to make my connecting flight. Was finally put on a different flight. On the way home, because my first flight was through American Airlines, and the second through British Airways (all in the same booking), I was only able to check in and get a seat on the American Airlines flight, as I was redirected every time to their website. Couldn’t check in for the British Airways flight so had to have a middle seat which is very uncomfortable. I always check in 24 hours before to guarantee a seat, but BA wouldn’t allow me to do this.",Business,First Class,London to Chicago,March 2019,no,Boeing 777
"""my question never answered""",6,Steven Fickle,19th March 2019,✅ Trip Verified |  Leeds Bradford to Las Vegas via Heathrow. Customer services handling of my question never answered it. Three times I asked them to explain why the cost of my one checked bag caused the fare to increase over £100 on the outbound flight. This was before any increase other than the increase announced for the short LBA LHR fare. I asked why the fare was so much when I could have booked a seat for the bag for about £50. The response was we are doing what everyone else is doing. They never could explain why the fare increased by over £100 when I indicated one checked bag. I asked to speak with someone but that was never responded to. Book LHR LAS at that time and one bag included. Customer service apparently did not understand what I was asking because the answer provided was non-responsive.,Couple Leisure,Economy Class,Tampa to Gatwick,March 2019,no,Boeing 777
"""service is of good quality""",10,B Roberts,9th March 2019,"✅ Trip Verified | London Heathrow to Madrid. I travel from LHR regularly. British Airways have proved to be reliable and their service is of good quality. As a frequent traveler, I've been able to use the priority boarding and also managed to get exit row seats. This airline is very good with providing tangible benefits to silver members. The lounge at Heathrow Terminal 5 is also very good and provides a good selection of food and refreshments. The bar is very well stocked and also a good selection of soft drinks available. I'm very happy with the airline service and would definitely recommend British Airways. Keep it up guys.",Business,Business Class,Chicago to London Heathrow,February 2019,no,B747-400
"""twenty years out of date""",1,D Gold,26th February 2019,"✅ Trip Verified |  London to Chicago. Could it get any worse? The flight to Chicago was equipped with the usual ancient Boeing 747-400. The British Airways First Class product doesn't come up to modern Business Class standards. This particular flight was late again, and the food / wine was simply awful. There is nothing remotely elegant about BA First Class, and the crew demonstrate no sophistication. This experience was like dining at your worst restaurant chain. Finally, not only is the aircraft tired and worn out, but the in flight so-called entertainment system did not work, and had to be rebooted twice. The First Class seat is a bad joke, and extraordinarily uncomfortable. British Airways are at least twenty years out of date with their entire First Class product. All that can be said about this airline is woeful. The Concorde First Class lounge at Heathrow is filthy dirty, and desperately needs refurbishment.",Business,Business Class,Gatwick to St Lucia,February 2019,yes,Boeing 777
"""crew were very friendly""",10,Anojan Sanmugarasah,18th February 2019,✅ Trip Verified |  London to Chennai. It was amazing. The crew were very friendly. The food was amazing and the seats were comfortable. T was overall an amazing flight and I enjoyed it thoroughly.,Solo Leisure,Economy Class,London to Billund,February 2019,yes,Boeing 777
"""Online Check-in did not work""",2,S Carinsky,4th February 2019,"✅ Trip Verified |  San Diego to Frankfurt via London. It all started when trying to check in online 24h before departure from San Diego to Heathrow. On long flights like this I always reserve an aisle seat. Online Check-in did not work, no reason was given. Ok, let’s call US hotline. I tried at least 40 times. Answers were either, that call could not be completed, check number or due to heavy call volume they could not process call right now. I did not make it through. As an act of desperation I today called a British number. The lady told me guess what: no more aisle seats available. Some other numbers I tried were available on weekdays only, good to know if you need help on a Sunday. So I‘ve got the strong feeling, that they do not even care about there customers. B On my flight to San Diego 5 days ago, my TV screen was gone and there was no way to change seats. Great overall experience.",Couple Leisure,Economy Class,New York to London via Geneva,January 2019,no,Boeing 777
"""reasonable flight""",6,David Ellis,30th January 2019,"✅ Trip Verified | A380 boarding is always a nightmare, but it was complicated on this occasion by multiple pax in wheelchairs and a delayed show-up by the pilots. Fortunately, we still managed to take off more or less on time. The cabin crew responsible for our side of the First cabin was personable but lacked experience. The food served for dinner was a mixture of good and mediocre. Warm salmon on ice cold salad is never a pleasant experience. The seats in First are reasonably comfortable although they lack the privacy of competitors' premium cabin. The duvet was made redundant because of the typically overheated cabin. One of the First toilets was out of action so we had to make use of the Club World loos upstairs. It would have been helpful if cabin crew had apologised for the inconvenience for the lack of the convenience, but no comment was made. The IFE was passable and the sound quality good if one's own noise cancelling headphones are used. WiFi was available but I didn't make use of it. Breakfast was unremarkable and I wish bread rather than pastries was offered. Deplaning was delayed by half-an-hour because of early morning congestion at T5 and the lack of a stand. Overall, a reasonable flight but not first class.",Couple Leisure,Premium Economy,Antigua to Gatwick,January 2019,no,Boeing 777-200
"""they assigned me a middle seat""",2,Derek Northcutt,22nd January 2019,"✅ Trip Verified | I understand completely why there is air rage in the skies when companies such as BOAC go out of their way to make the travel experience an stressful and unpleasant as is humanly possible. I paid $813 to fly r/t LAX-BUH and yet they want an extra $150 to have a desirable seat. I understand if you check-in 24 hours before departure you receive a seat from those available, but why is it they assign you the worst seat available when betters are there? In my case, they assigned me a middle seat on a 787 when both of the adjacent aisle seats are available to assign. It is baffling. The ground crew and the inflight staff are excellent but can do little with the oppressive business decisions their executives make - everything comes down to make every penny they can. And why am I flying BOAC? They owed me £25 from the last flight b/c the inflight entertainment system was inop for 1/2 the cabin and so we all had to sit in the dark with nothing to do for a twelve-hour flight. On top of that, their seats have so little padding and cushion that only the plumpest can sit in their seats longer that 15"". For normal-sized adults, it is as agonising as the rack must've been. And of course you only get compensation by patronising them again. Now I know: ever a free ticket on BOAC is overpriced.",Couple Leisure,Economy Class,San Francisco to London,January 2019,no,777
"""seats booked not given""",3,B Thane,15th January 2019,"✅ Trip Verified |  Heathrow to Vancouver. The seats booked not given, took 3 months to respond to a complaint after submitting multiple messages to them for an update. A dirty plane, fantastic front line staff I would never fly BA again.",Solo Leisure,Economy Class,London to Mumbai,December 2018,yes,Boeing 777
"""I think they had overbooked""",2,D Garitadis,3rd January 2019,✅ Trip Verified |  Athens to Los Angeles via London. Worst flight experience. I had a ticket from October travelling 1st December. 24hrs they decide to cancel the flight and give me the alternative for another flight 3 hrs later. Athens to Los Angeles via London same day. When arrive at London I realize from the announcement screen that my flight was operated. After I heard the announcement last call before departure. I checked at the BA information desk and confirm my flight (the one was cancelled) I asked them and reply: We found aircraft 12 hrs before and rescheduled flight. I send email and I had same response twice: Flight never operated or rescheduled. I think they had overbooked flight and didnt care about it.,Couple Leisure,First Class,Gatwick to Barbados,December 2018,no,Boeing 777-200
"""Fantastic first class service""",10,Alex Johnson,19th December 2018,"✅ Trip Verified |  Moscow to London. Fantastic first class service. The Moscow lounge was surprisingly good, with excellent Runway views. Quick boarding, and I was escorted to my seat by the crew. The new First seats on the 787-9 fleet are a real upgrade from the older product. There's plenty of space, a cupboard and several little storage bins in addition to the overhead bin space. The 23 inch flatscreen IFE screen offered brilliant picture quality and the sound quality was excellent thanks to the noise cancelling headphones. The dinner menu was extensive and the food fantastic, the best airline meal I've had. Drinks were constantly topped up from boarding to arrival. The crew were very attentive and friendly with it. A fantastic experience, and I'll look forward to my next opportunity to fly in this cabin.",Couple Leisure,Economy Class,Bucharest to London,December 2018,no,A320
"""wonderful cabin crew""",10,Fakheezah Borhan,10th December 2018,"✅ Trip Verified | Kuala Lumpur to Mexico City via London. The journey from Malaysia to Mexico alone for business trip would be very boring. However, during my trip from London to Mexico City on 2 Dec 2018, it is quite interesting with the cabin crew facilitating me, especially associated with Muslim needs on food. They are polite and talk to me with big smiles. So, when I returned back to Malaysia and transit in London from Mexico City on 5 Dec 2018, I wished I will be able to meet them again. Hope to see this wonderful cabin crew team again in my next trip.",Solo Leisure,Economy Class,San Diego to Hannover via London,November 2018,no,Boeing 777
"""not offered any assistance""",1,Sally Macdonald,27th November 2018,✅ Trip Verified |  London Heathrow to Stuttgart. Absolutely disgusted with BA. my husband was asked to put his one piece of hand luggage in the hold due to the flight being busy and he agreed. BA had one job to do - put it in the hold and make sure it arrives in Stuttgart. This has proven too difficult. The bag is lost and they have not offered any assistance or support.,Business,Economy Class,Amsterdam to London,November 2018,no,A320
"""plane seating is worn out""",1,H Parker,12th November 2018,"✅ Trip Verified |  Buenos Aires to London. We flew overnight Friday 9th November. The plane seating is worn out and uncomfortable, there were large numbers or Argentinian passengers on the plane yet I saw no staff that spoke Spanish. The chicken dinner was described as Curry but there was no sauce on it. The bread roll was stale and dessert stodgy, During the night no water was offered to me. It was not possible to charge electronic equipment, the seatback screens were small with a limited choice of entertainment.",Solo Leisure,Business Class,Newcastle to Las Vegas via London,October 2018,yes,A319 / Boeing 747
"""restored my faith in BA""",9,Christopher Rainbow,25th October 2018,"✅ Trip Verified |  While it is still fresh in my mind, I’d like to commend the hard working crew of my BA flight from St.Petersburg to London Heathrow on 23rd October 2018. The check-in staff were very professional and helpful and assisted me with a query. Boarding was operated remarkably efficiently and in a precise and orderly manner. The cabin crew were welcoming and very professional in their appearance and demeanor too. The cabin was spotlessly clean and the flight departed on time and arrived slightly early. The captain was informative. My only gripe was the lack of a route map on this flight and the M&S buy on board option was a bit tedious. Disembarkation was equally well managed and passengers were fare welled in a courteous and sincere way. This flight has restored my faith in BA. Well done to the superb crew!",Business,Economy Class,London to Vienna,October 2018,no,A320
"""does not seem to get any better""",3,Luc Vannevel,17th October 2018,"✅ Trip Verified |  Johannesburg to London. I tend to stay with an airline as a frequent flyer and I fly business class. I have seen a change for the worst in BA service, and it does not seem to get any better. Bedding finally a decent pillow, a very good one indeed. The rest is a waste of money unless a new announced Club World seat is introduced where all this will fit perfectly.  Seated in a window seat makes it  impossible to make up a bed properly with them new things. I don't expect top food in a plane but I expect service. If you announce things, make sure you have them. On some flights Champagne is not being served when you have taken your seat. Premium economy however gets a sparkling wine.  You must eat when they order you to eat. They seem to have run out of certain items such as a gin other than Gordon's. You have to decide upon breakfast before you even had dinner. Entertainment, make sure you bring your tablet with downloaded things to view. BA offers you the most limited offer.",Solo Leisure,Economy Class,Dublin to London,September 2018,no,A380
"""seating is still hopeless""",6,Clive Drake,25th September 2018,"✅ Trip Verified | London - Pisa (Return). I fly this route often as we have a house in Tuscany. This, in all reasonableness was the best so far - but only just. Outbound we went through the ""First"" wing check in at T5. (We are Gold card members). The breakfast we had in the lounge was just about OK. The South lounge was rammed. We took off on time and I declined a cooked breakfast. The lady next to me had a full English and it did look rather nice. The Captain popped out for the loo, and I caught his eye and enjoyed a pleasant ten minutes or so chat about aviation. A very nice bloke, who landed the plane superbly. Coming home, we were delayed by 45 minutes due to storm Ali. We had a very good lunch with the new Club Europe menu which came into effect two days earlier. A nice prawn cocktail and a very nice coronation Chicken. Downed a couple of G&Ts. FAs on both flights were great. There has been a massive improvement here on the catering side. The seating is still hopeless. Three seats between two and zero legroom. BA really should look at the competition in the Far East who offer excellent regionalized business class. The product is only worth it in a Sale or Avious points. The every day fare price is ludicrous.",Business,Business Class,London Heathrow to New York JFK,September 2018,no,Boeing 747-400
"""This was a great flight""",9,D Kemble,12th September 2018,"Not Verified |  London Heathrow to Dubai. This was the first time I had flown in first class  on BA. I had read many reviews before travelling and they were somewhat mixed. BA's first class cabin is not even close to the best in the skies but then again it isn't the same price and reward tickets are readily available if you are a little bit flexible on dates. We were on a 777 which is probably one of the oldest in the BA fleet. The cabin was clean but a little bit tired in places but the seat was very comfortable and spacious. The sleep suit and amenity kit were great with lots of little touches to make you more comfy. It is nice they offer a male and female kit, my wife was delighted with the contents. The Champagne that BA offer in first is superb. I enjoyed a couple of glasses in the lounge and some on board and it is probably the best champagne I have tasted. Choice of other wines is good too and a particular treat is the Johnnie Walker Blue Label if you are a whiskey drinker. Food was very tasty and well presented. I had a seared prawn amuse bouche followed by poached baby pear with blue cheese and walnut brittle then Lamb Machboos as a main course and finally chocolate mille feuille. We were offered ice creams a hour or two later and then afternoon tea a couple of hours before landing. I cant really fault any of it. It was the best airline food i have ever eaten and better than a number of restaurant meals too. IFE was decent although the screen has to folded away so no entertainment during take off or landing,. I believe this has been rectified in later versions of this seat fitted to the 787. I do wish they had a full series of a show rather than just some random episodes but there was plenty of choice. The thing that really made this flight special were the cabin crew. From the moment we stepped on board until we deplaned they were fabulous. Attentive with out being over-bearing. Witty and charming but still professional and always available to attend to your every need. They were superb. Wifi was available but the page to connect didn't load up when i tried it. I dint really pursue it to be honest as i was happy to enjoy the other pleasures first had to offer. This was a great flight and i would wholly recommend that you try out first. Whether i would choose it over Club World would be on flight by flight basis. You have to do it once though!",Family Leisure,Business Class,Pisa to Toronto via London,September 2018,yes,A319 / Boeing 787-9
"""never provide any assistance""",1,C Leane,30th August 2018,"✅ Trip Verified |  Madrid to Heathrow. I fly with BA on a regular basis and am a gold card holder, their service attitude and facilities drop lower and lower. The planes are filthy, not cleaned properly between flights, the staff are hit and miss - but more miss than anything and very poorly turned out. The food in business is average and the seating in the newer planes is terribly uncomfortable - and as for customer service, there is no point in ringing them they are useless, rude, hostile and will never provide any assistance whatsoever.",Family Leisure,Economy Class,London to Las Vegas,July 2018,no,Boeing 747-400
"""asked if I would like any food""",5,K Darinic,17th August 2018,"✅ Trip Verified |  Zagreb to London and during the check-in (24 hours before, I checked in via app) I was offered no choice of seating. During the flight, I was asked by stewardess if I would like any food - I find that approach not pleasant at all. I was not personally invited to use the Lounge. I find that lacking for a business class fare.",Couple Leisure,Business Class,Paphos to Gatwick,July 2018,no,A320
