title,rating,author,date_published,review_text,Type Of Traveller,Seat Type,Route,Date Flown,Recommended,Aircraft
"""70 days chasing BA’s complaints department""",1,R Layne,15th January 2025,"✅ Trip Verified |   I booked through BA because Loganair don’t have representatives in Manchester airport. Loganair cancelled the flight but someone at BA marked the flight as delayed by 52 minutes. I’ve spent over 70 days chasing BA’s complaints department who are at best totally ineffective. They won’t put you through to the people dealing with the claim (apparently they don’t have the facility to do so!), they won’t phone Loganair, they won’t look on Manchester airports historic flight website to confirm the cancellation, they won’t put you through to a supervisor in fact they do very little but apologise for how little they do.",Solo Leisure,Business Class,Cape Town to London,December 2024,yes,Boeing 777
"“victims of their new supper service""",7,P Gough,12th December 2024,"✅ Trip Verified | Check in was fine, but no priority/fast track lines for security or boarding. There is only one lounge option for first class customers in Mexico City, which is the American Airlines admirals club, which is abysmal. There is a free bar, serving cheap alcohol – an awful food selection – and nowhere to shower. On board – I find the seat really comfortable. The crew were fantastic, and I’m starting to really see some consistency in the quality of their first class crew. The drink selection was fine. The food was appalling. We were the victims of their new supper service. This is basically a dinner service with a lot less options/choice. No fish/seafood options on either the starters or the mains. First choice of Main unavailable as only two had been loaded. The fillet steak, so drying and overcooked, that I heard at least three people send it back. Pretty impressive for a cabin of just eight passengers..Dreadful dessert and cheeseboard. luggage off swiftly the other end – so good to see priority tagging working.",Solo Leisure,Economy Class,Keflavik to Cape Town via London,October 2024,no,A350
"""won't be using her return ticket""",1,Hock Herng Chia,8th November 2024,✅ Trip Verified |   A transit visa is required for my partner to transit via London to Iceland. So I had to buy a separate ticket for her via another airline. When we reach Iceland I emailed British Airways telling then she won't be using her return ticket and requested for a partial refund. 2 days later. I received an email from customer service that I need to contact one of their service centres via the provided link. I replied to say the link only goes to a page with various British landline phone numbers to call and explained that I am overseas then and it will not be practical to do this via international calls. They replied to say I can only do this by contacting the service centres. So the airline end up taking my money regardless.,Solo Leisure,Economy Class,Vancouver to Gatwick,September 2024,yes,A380-800
"""Who can trust BA to travel2",1,J C Albrecht,31st October 2024,"Not Verified |  The flight scheduled at 1840 left 2hours 40 minutes alter due to late arrival of incoming aircraft from Naples, as a result I missed a connection from Istanbul to Dubai, Nothing unusual. The issue acknowledged by the captain is that the plane had been late since the morning flight from Rome with rolling effect until the evening. As this was the case, whey did BA not contact me and all other passengers, I could have made other arrangements and fly early to Istanbul and not miss my connection resulting in a £300 charge and a long delay. BA has certainly lots of staff who could have informed by using the email or text. Obviously passengers are of no utility to BA once the ticket is purchased. Who can trust BA to travel? Not me now after such poor handling of a simple matter.",Solo Leisure,Economy Class,Johannesburg to New York City via Heathrow,October 2024,no,A320N
"""crew were all very friendly""",8,James Tapley,8th October 2024,"✅ Trip Verified |   I recently flew from New York back to London with BA, this wasn't my first long haul with them however it was my first time travelling in World Traveler Plus. We boarded the aircraft on time and stress free and my first impression was good. The cabin was clean and the leg room was good. The recline on the seat was generous and combined with a footrest it was quite comfortable. Waiting on our seats was a decent quality cushion and blanket as well as an amenity kit. The amenity kit contained some good headphones, socks, an eye mask, lip balm, pen and toothbrush and toothpaste. Once boarding was complete we were offered a pre departure drink with orange juice, water or champagne being the options. The crew were all very friendly and professional and did their upmost to ensure that everyone was happy. Once in the air we were offered a hot towel and another round of drinks, this time with a lot more selection. Drinks were offered several times throughout the flight. A menu was also handed out not long after take off, the starter was quinoa and for main there was a choice of chicken, meatballs and pasta or a vegetarian mushroom dish. I chose the meatballs and they were really good. My only real complaint about the flight was people not getting the dish they wished for. We were sat in the last row of the premium economy cabin and by the time the meal service got to us all of the chicken dishes were gone. The moral of the story is that if you sit at the front of the cabin, you will likely get your preferred meal option. After the meal I chose to watch some shows on the well sized entertainment screen, BA is definitely up there for best inflight entertainment. Finally about an hour before landing we were served a breakfast snack, this come in the form of a warm egg and swiss cheese bagel. It was edible but also a little soggy and didn't really taste of much, I certainly wont be craving one anytime soon. We touched down into Heathrow on time before disembarking the aircraft and picking up our bags, everything was very efficient and we were on our way in no time.",Couple Leisure,Economy Class,Heathrow to Berlin,July 2024,yes,A321
"""cannot get compensation for our flight""",1,S Grimsditch,13th September 2024,Not Verified |  Absolutely disgusted with BA. Our flights were cancelled on 1 May by BA even though the flight still departed. We had a connecting flight from Manchester to Heathrow which was cancelled due to weather so could not get compensation for that flight. But now it turns out we cannot get compensation for our flight to Seattle either even though BA actually cancelled it for us. I will never fly with them again.,Business,Business Class,San Diego to Athens,August 2024,no,Boeing 777-200
“service offered was exceptional”,9,Arthur Grace,26th August 2024,Not Verified | Although all four flights were delayed the service offered by BA was exceptional. The food and drink offered on the domestic and international sectors was extremely good as was the attention of the cabin crew. Some disorganised boarding on return from Newark. The BA lounge service at Newark was excellent. Overall a good and satisfying trip.,Solo Leisure,Business Class,Vancouver to London,July 2024,yes,A350
"""the crew were fabulous""",8,G Jones,12th August 2024,"✅ Trip Verified | An excellent flight! Despite this being a 4.5 hour flight in a A320 that is configured for short hops to Edinburgh or Glasgow, and despite there being no IFE, I ended up really enjoying the flight. I don't know if it was just that I had really low expectations, but I thought the crew were fabulous, and the food and wine was surprisingly good. The plane itself looked very new and was in perfect condition. From the very start, I really liked the crew - they were all cheerful, genuine, and clearly enjoying their work. I noticed they constantly had friendly and proactive interactions with passengers, and when the food and drink came around, they were generous with the wine - and happily provided top-ups later in the flight. The food box was deceptively small - it actually contained a decent selection of food, and was more than enough to keep me feeling satisfied on this trip. There were regular, and detailed, updates from the cockpit which I also appreciated. So whilst the hard products on this flight were limited, it was the service - and the genuine enjoyment of the crew - that won me over.",Business,Business Class,Sydney to London,August 2024,no,A380
“Great customer service from BA”,10,S Irving,2nd August 2024,"✅ Trip Verified | Flight cancelled due to bad weather, BA contacted me by email immediately and provided an alternative booking as well as a link if their suggestion for a different flight wasn't convenient. Clicked on the link and was assisted promptly by a service rep who rebooked me and sent all details within a few minutes. Great customer service from BA....well done.",Solo Leisure,Economy Class,Toronto to London,July 2024,no,A380-800
“wholly inadequate customer service”,1,P Jackson,30th June 2024,"✅ Trip Verified | Flight cancelled with no reason given less than 24 h before departure. The earliest offered replacement on their (terrible to use) app was 3 days later, which was unacceptable. Their phone lines do not work and would reject your call due to being overwhelmed. Even submitting a claim on their website is frustrating due to their terrible interface. Overall, terrible company with wholly inadequate customer service.",Couple Leisure,Business Class,London to Manchester,June 2024,no,A320
"""flight itself was quite good""",9,Jonathan Rodden,10th June 2024,"✅ Trip Verified |  Flew British Airways on BA 434 London Heathrow to Amsterdam. I was able to check in at the BA First Class check in area in Terminal 5 and this is very fast and efficient. The lounge was quite busy; however, I was able to find space. The food, snacks, and drinks available was excellent as was the overall service. I also like the BA First Class Check in area as the security clearance is fast. Boarding was a little chaotic, however we boarded on time and the take off runway was close to the departing gate, therefore no delays. The flight itself was quite good as was the cabin crew and the meal service.",Solo Leisure,Economy Class,London Heathrow to Singapore,May 2024,no,A380
“premium price for a sub-par product”,3,L Tomlinson,26th May 2024,"✅ Trip Verified |  A premium price for a sub-par product - flew BA (031/032) LHR and HKG and return in May. We had originally booked when the aircraft was allocated the club suites - paid for seat selection. A couple of months prior to the trip, the aircraft was changed to the 2/3/2 layout with the yin/yang seat configuration. We had been allocated 2 of the 3 middle seats, so paid again to select the window and aisle. The hard product is poor - the seat space lacks any form of storage that remains accessible when the seat is in the flat position - nowhere to put specs, a book or phone. Additionally, the window seat passenger has to climb over the feet of another passenger to use the toilet etc - really poor layout. The planes on both legs of the journey were tired and shabby. The crew on the outward journey were enthusiastic and helpful - the return crew seemed less adept at managing the service. The outbound catering was acceptable - but the presentation on tiny plates does not compare favourably with competitors. The catering inbound was very poor. The welcome ‘champagne’ was truly awful. This is a poor product at a premium price - and sad to say, this pair of self-funding passengers won’t choose to repeat the experience. The lounge at Heathrow on the outbound sector was packed to the rafters and was a poor experience. Very disappointing.",Solo Leisure,Economy Class,London to Valencia,April 2024,no,A319 / A320
"""undiscerning and insincere compensation""",1,Ezra Tan,27th April 2024,"✅ Trip Verified |  Paid for a 14 hour long flight ticket which includes use of the in-flight entertainment system. Ended up in a seat where the in-flight entertainment system was malfunctioning and could not be used at all. Flight attendants sought to perform a ""service recovery"" through their customer relations team. Contacted by the said team slightly more than a week later with an offer of an eVoucher that can only be used in purchasing additional flight tickets with BA. Explained to them that I had no intentions of travelling again within the next two years so I had no use of an eVoucher and sought for an alternative form of compensation instead, something that could really be useful instead. Customer Relations simply brushed my request off as them unable to offer any alternate ""gesture of goodwill"".  Compensation in British Airways is a matter of ""goodwill"". Pay for a ticket but don't get what you paid for in full. Compensation is one that requires you to spend even more money on the airline (so that they can disappoint you further). An ultimately self-serving, inconsiderate, undiscerning and insincere compensation. Which in itself isn't even anything they feel guilty or remorseful about, because any compensation is a ""gesture of goodwill"", something you don't deserve in their view.",Couple Leisure,Business Class,Doha to London Heathrow,March 2024,no,Boeing 777-200
"""service was slow and unfriendly""",4,David Williams,2nd April 2024,"✅ Trip Verified |  Flew business class from Doha to London on 31st March. The service was slow and unfriendly, even one of the male cabin crew working in business class asked the female cabin crew who was looking after the area where I was in to smile. I ordered waffles for breakfast and they looked like they’d fallen off the plate and had been thrown back on (see photo). The plate that the waffles were served on was so hot that when I moved the plate I burnt my finger. I wasn’t warned that it was ferociously hot. I was shocked at how bad the food presentation was, but didn’t feel comfortable saying anything to the cabin crew as she wasn’t approachable or friendly. For lunch, the bread roll was so dry and rock hard that I couldn’t cut through the ends. Not sure why the food and service was so bad on this flight as generally BA food is good and is well presented. Also, the Wi-Fi wasn’t working on the flight.",Family Leisure,Economy Class,Montreal to Venice via London Heathrow,March 2024,yes,Boeing 787-8 /777-200 / A320-200
"""Utterly outrageous""",3,Solomon Pachtinger,19th March 2024,"✅ Trip Verified |  Waited an hour to check-in at the Paphos business check-in. Staff utterly incompetent. Flight crew in business class removed my ruck sack from the flight bins without my consent to make way for another customer luggage. I was then coerced to have my luggage at my feet throughout my flight. Utterly outrageous, last thing you would expect in BA business class.",Solo Leisure,Economy Class,Singapore to Auckland via Sydney,March 2024,no,Boeing 777-300
"""it was extremely underwhelming""",3,E Gayerlo,4th March 2024,"✅ Trip Verified |  On the my trip to Mexico City, I had the opportunity to experience BA long-haul business class for the first time and it was extremely underwhelming. First of all, boarding to our flight to Mexico city was done with buses. Every inch of the bus was filled with passengers and we couldn't even breath. The Club World experience is not personalised and it doesn't make you feel special. The flight crew were giving the welcome drinks as if giving free food at a food bank and I wasn't offered a non-alcoholic choice due to sitting on the last row of business class cabin. The same rude serving attitude happened when the flight attendant was serving ice-cream mid-flight on the way out. He literally threw the ice cream to my head as I was in the middle seat that is covered from all sides that makes flight attendants hard to reach.  The most striking issue with the cabin is the state that the seats are in. They were their old style yin-yang seats and they looked pretty old, with no storage space, and most functionalities are working with a struggle. My entertainment screen was not working well and it was quite unstable. When the flight attendants were playing the security on my way out, neither of the seats in my area playing the safety video and the flight attendants had to re-demonstrate the security instructions manually. On the way in, the crew opened my screen for security demonstration but it kept closing in. When I asked if there is a way to keep the screen open, the flight attendant joked saying ""I will tell the pilot to fly with an angle so that the screen is pulled down and it will stay open"".  I found this attitude unacceptable. The screens were old and bad quality.  I was quite underwhelmed by the food provided on board. They looked great on menu card but were quite bad when they are served.I would not recommend BA business class product based on this experience.",Solo Leisure,Premium Economy,"Austin, TX to Shannon, Ireland via Austin",January 2024,no,Boeing 777
"""all needs a serious rework""",5,S Jackson,11th February 2024,"✅ Trip Verified | I am a British Airways Gold Guest List member (with Lifetime privileges). In spite of that I have given up Britsh wherever possible. I take ten or more trans ocean trips a year. I am fortunate to be able to fly First Class - unfortunately British no longer has a First Class product - the sell one by that name at First Class prices but in fairness deliver what you would consider a very good Business Class experience. I should point out that there are airlines who sell Business Class that in fact are better than any British First Class experience (Qatar, Emirates). I have flown many millions of miles on British. Last week I completed an around the world trip on Emirates and Qantas all A380. In the millions of BA miles I never had an experience as good as what I experience on EK and Qantas. A very long time ago the food and beverage service on BA was truly extraordinary - today it would be a bit of a stretch to even call it ordinary - so sad a decline. Seat comfort (in First), lounges food, beverage all need serious rework. If you are a First Class traveler British is just not an option. Sad, truly sad.",Solo Leisure,Economy Class,Boston to Düsseldorf via London,January 2024,no,Boeing 777-200
"""unprofessional attitude of the pilots""",6,D Carreno,21st January 2024,"✅ Trip Verified |  BA 246 21JAN 2023 Did not appreciate the unprofessional attitude of the pilots. Flight scheduled departure 16:20. Advised boarding time 15:20. Whole flight full of passengers waiting at the gate to board at 15:20. 15:40 the cabin crew board. 15:55 the pilots board - each with a Sao Paulo Airport Duty Free branded shopping bag. 16:20 the flight is still boarding. Finally pushes back just before 17:00, 40 minutes late. Captain came on the intercom to announce the delay was due to 'traffic between the crew hotel and the airport'. Sorry Captain the whole plane saw you and your pilot colleagues board fifteen minutes after the cabin crew clutching your duty free that you and your pilot colleagues still made time to stop for.",Couple Leisure,Business Class,London to New York,November 2023,yes,Boeing 777 -200
"""Gate agent was extremely rude""",6,K Higgins,3rd January 2024,"Not Verified |  Extremely rude ground service. We were non-rev flying and London was our connection/layover. Gate agent was extremely rude and forced me to check my carry on suitcase with the explanation that it was “oversized.” However, when I put it in the sizer, it fit perfectly without force. The plane was not fully booked and had lots of room overhead. The gate agent was insistent and rushed us with no regard for the fact that we would have to redo security in order to get our bags again, as we were switching airlines and needed to carry them on due to our non-rev status. The flight itself was good, attendants were polite and helpful. No complains there. Just extremely unhappy with the gate agent service. I understand that it is not a pleasant job and frankly I would not be overjoyed to work there either but that does not explain why we had to be inconvenienced with no fair explanation or attention.",Solo Leisure,Economy Class,Indianapolis to Mumbai via London Heathrow,December 2023,no,A329
“The most ridiculous thing I've heard”,1,C Shaw,20th December 2023,"Not Verified |  Beware! BA don't provide any refund due to a very serious medical reason. My father was diagnosed with a severe heart defect a couple of weeks before his flight date and BA refused to give any refund as this was not a good enough reason!! We sent them a medical note from his doctor saying he is unfit to travel due to potential heart failure and needs to have heart surgery as soon as possible, and the operator totally dismissed it. They said only thing they can do is change the travel date within a year. Heart surgery recovery takes months and it's highly unlikely that he will be able to travel within the year, meaning he would lose his ticket and money! They said they can't do anything to help, not even change the name on the ticket so someone else can use the tickets! The most ridiculous thing I've heard!",Solo Leisure,Business Class,Gatwick to Las Palmas,December 2023,yes,A320
"""onboard service was efficient""",10,S Deyle,9th December 2023,✅ Trip Verified |  The flight took off a little late due to Heathrow congestion but still landed on schedule. Boarding was smooth and the onboard service was efficient. A small snack was served for free with a bottle of water; additional items were available for purchase. The cabin and toilets were very clean. Overall an unremarkable flight but in a good way!,Business,Economy Class,Brussels to London,November 2023,no,A320
"""Flight was smooth and quick""",8,M A Collie,16th November 2023,"Not Verified |  Boarded on time, but it took ages to get to the runway due to congestion. Flight was smooth and quick. Snack and drinks were good for a short flight. Landed only about ten minutes late. One bag of three left in London, forms quickly filled in, and the bag was delivered the next morning.",Couple Leisure,Economy Class,Anchorage to Heathrow via Barcelona,October 2023,no,A320
"""reflect a downward trend of the airline""",6,C Barton,28th October 2023,"✅ Trip Verified |  London Heathrow to Gibraltar on 24th October 2023. I shall start by reference to the booking process. I used the BA website to reserve the seat and food the website to be easy to use and clear in every aspect. The flight was due to depart from terminal 3 but the passengers were bussed for a good 15 minutes to a different part of the airport where the aircraft was on a stand. When boarding the flight the cabin-crew kept a very low profile and this was maintained during the entire flight. The captain made 3 brief announcements during the flight. There was no in-flight entertainment. The seats were clean and comfortable enough for a short flight. The lack of catering was overt. Other than a tiny bottle of water and an inedible “breakfast bar” one had to use an online system to order even a drink and of course pay for it too. The passengers next to me could not use the online system as it doe not seem to work and the cabin refused to sell them a coffee because of this fault. Moreover, the USB charge points did not work either. Given the early hour of the flight it is a poor show that there are not even for sale items available from a trolley service. The system BA have in place is not good enough. The flight arrived on-time. The disembarkation was inefficient though and poorly managed and the crew were not to be seen. The crew were wearing the new BA uniform and it seems to reflect a downward trend of the airline. To be candid, there was any difference between this BA service and that of so-called “budget” rivals. On this route BA have a monopoly and so I did not have an option to use the services of a different company.",Solo Leisure,Economy Class,Geneva to London Heathrow,October 2023,no,A320
“I hate British Airways!”,1,S Carter,17th October 2023,"✅ Trip Verified |   I hate British Airways! We get to London on Oct 3 and our next flight is cancelled. We stand in line with 1200 other people to get it fixed and they tell everyone to leave the airport and call them to fix. They book us the next day..via online. Don't offer vouchers for hotel, we will miss our tour. Now trying to get home from Istanbul. Plane is here but should have started loading an hour ago. No explanations. May miss next flight. Will never travel with them again. Was this same problem April 2022 flight.",Couple Leisure,Economy Class,Atlanta to Glasgow via London,September 2023,no,A321
"""The worst airline I have ever flown""",1,T Hanson,7th October 2023,"✅ Trip Verified |   The worst airline I have ever flown with. Allocated the very back row next to the toilets and galley. No chance of getting any sleep, question asked of possible seat movement ignored and getting bumped the entire time by cabin crew walking or pushing kart up and down aisle without one apology. Would have been better sitting in the luggage compartment.",Couple Leisure,First Class,Dallas to Dubrovnik via Heathrow,September 2023,no,777-300 and A320
