title,rating,author,date_published,review_text,Type Of Traveller,Seat Type,Route,Date Flown,Recommended,Aircraft
"""want to be a no-frills airline""",2,C Morgan,12th April 2017,"✅ Verified Review |  I had to change my flight back from San Diego because of an accident that required a stay in hospital. I'd flown out first class and had a business class return. I do understand why some fare structures mean that flights are not changeable, but BA were absolutely no help at all. They flatly refused to change the flight so I had to buy a ticket in the only available class - World Traveller Plus. Which cost $3,300 - one way. The first class fight to was OK - nice cabin crew and good food, but grubby cabin and clear cost cutting - no snacks, water etc in the galley like there used to be. Absolutely no help on the return trip - despite requests before the flight - because I was walking with a stick. I'd requested an aisle seat, had to ask again at check in as they had given me a seat in the middle which would have really annoyed other passengers as I tried to get across them to go to the loo etc with my stick. Really poor value at $3,300 and rubbish seats, uncomfortable and tv screens that aren't great. The food was awful - clear that costs are being cut massively. Maybe their plan is to offer such rubbish food that when they introduce food you have to buy in long haul we all feel grateful! It's a pity really. It's obviously BAs call if they want to be a no-frills airline, but I'd rather they were honest with us so that we can choose amongst the many other no frills airlines. But they keep trying to say that BA is a leading brand with strong values when clearly they've decided to cut costs wherever they can but still charge high prices. Might make them profitable to be a follower in the short term but I suspect people will vote with there feet and fly with someone else.",Couple Leisure,Economy Class,Marrakech to London Gatwick,April 2017,no,A320
"""can no longer live on past reputation""",1,L Johnson,6th April 2017,"✅ Verified Review | Having only flown easyJet / Ryanair for all my short-haul journeys over the last 10 years or so, I was pleased to see a relatively low-cost BA flight for my round trip from London to Rome. In hindsight, I wish I'd booked a different airline and not booked BA based on its legacy reputation. To say that this was a disappointing experience would be an understatement. I expected, at the very least, an equivalent service to that of other low-cost short-haul airlines, certainly not worse. Narrow seats are to be expected but these seemed far more narrow than the norm. Regardless of this, there is no excuse for a seat being so uncomfortable. Even on a 2.5hr trip this was almost unbearable coupled with the fact that, at a relatively small 5""8, my knees were grazing the seat in front. Lucky the seats had no recline feature to make matters worse. I was also tantalised by the BA bragging of M&S supplied food. I am more than happy to pay for this on a short-haul flight and don't expect anything for free. It certainly looked delicious from the pictures and descriptions. Sadly, being sat in row 22, this meant that after the frustratingly slow pace of the cabin crew finally getting to me meant that they had run out of pretty much everything. No sandwiches, no fruit salad, no yoghurt. I asked what they did have. Their response 'Bottle of water or a Kit Kat'. After asking the cabin crew why there was so little option their response was surprising to say the least. 'They never give us enough food. It's mad. They give us 6 sandwiches for the whole flight'. Needless to say that BA can no longer live on their past reputation. They had an opportunity to position themselves as the best of the low-cost carriers. Sadly, they probably sit about 4th or 5th down the list. I'd say I'd give their long-haul a chance but after this experience, I won't bother. What a shame.",Business,Economy Class,Miami to London,January 2017,no,Boeing 747
"""very lazy and oblivious staff """,3,Ashley Mayes,29th March 2017,"✅ Verified Review |  London Heathrow to Los Angeles. Worst flight ever with British Airways, you can see why they have fallen out of the top 10! Very lazy and oblivious staff members. They ran out of food during both meal times. We were promised a replacement but nothing came until they cleared away the trays. All we got was ""oh sorry"" and a re-re heated meal. After leaving the service light on for 15 minutes looking for some water, I went to the back of the plane to find 2 members of staff reading the paper. Even after complaining to customer service after the flight we weren't treated much better. If it wasn't because for the avios program it was enough to put me off for a life time!",Solo Leisure,Economy Class,London Heathrow to Johannesburg,March 2017,no,Boeing 747-400
"""never use British Airways again""",1,C Leventis,22nd March 2017,"✅ Verified Review |  I am 73 years old. Was scheduled to fly from Montreal to Heathrow on January 30th and from there to Athens on February 1st where I would catch another connection to Cyprus. I was delayed in Montreal for 5+ hours (never given a reason why), stuck in the aircraft from 9 pm until 3am cause customs was closed. Had to wait another 6 hours at Heathrow. Missed my connection to Athens and my connection from Athens to Cyprus. Was never offered accomodation or compensation. Had to book another flight on February 2nd and book a stay at a hotel close to Athens airport. Contacted British Airways, they replied with the usual vague comments. I followed up and never got a reply. Clearly I am being ignored. I will never use British Airways again.",Family Leisure,Economy Class,GOT to SFO/PHX via LHR,March 2017,no,Boeing 747-400 / 777-200
"""delayed 1 hour due to no cleaners""",3,T Madson,16th March 2017,✅ Verified Review |  Gatwick to Mauritius. 12 hour flight delayed 1 hour due to no cleaners. Advised by First officer that Cabin Crew had to clean the plane! Crumbs on seat and greasy windows. Otherwise fairly average flight until woken up 2 hours out of Mauritius to be advised that toilets on plane were full and no further use please! Just after waking up most people like to visit the toilet surely? Anyway seatbelt signs then illuminated though little if any turbulence. One hour out First Officer came on again with further abject apology re toilets not working as apparently the toilet tanks hadn't been emptied at LGW before departure. Two hours with legs crossed for over 200 pax! Surely flight should never have departed without emptying tanks. Trust they maintain the engines better!,Business,Business Class,Orlando to London,March 2017,no,Boeing 777
"""not a business class product""",2,P Reece,9th March 2017,"✅ Verified Review |  Newark to London Heathrow. This was the first time I have flown long-haul BA for sometime (although I am BA Goldcard holder due to my travels on other Oneworld Carriers). The lounge in Newark is lovely and mostly quiet although there is no separate First section and food is only offered for business and first passengers. Super views over the airfield. Boarding was smooth however the hard product is awful compared to the competition. This was a new Boeing 787 however the Ying-Yang seat configuration, no air vents, high density, poor quality food (and very little of it), very basic toilet facilities (compared to American business class on the same route), a shoe bag instead of amenity kit. The product is akin to an excellent premium economy and not a business class product. Flight attendants were ok but just going through the motions. I asked not to be served breakfast and just a cup of tea but this was forgotten about. The arrivals lounge is grim - tiny plastic and linoleum shower cabins which are not clean and too small. Overall very poor and I will not fly with them again unless no other options.",Couple Leisure,Business Class,London Heathrow to Pisa,March 2017,no,A321
"""Overall a good flight""",7,E Smyth,4th March 2017,"✅ Verified Review |  Overnight flight from St Lucia to Gatwick. Efficient check in. Lounge at St Lucia was pretty dire, some snacks provided which were ok. Plane on time. Club world middle seats which were a good option for us. The food options on this flight were not of the usual standard I would expect of business class. The starter of melon and cucumber was poor. The chicken main was overcooked and lacked any flavor. Drinks were good. Some options missing as not loaded but quality generally good. FA's were in the main good but some better than others. I was well looked after. However, the FA attending to my wife lacked experience and it showed. Overall a good flight. On the subject of baggage, it would seem that few of us with priority tagged baggage received their bags quickly (mine were almost last!).",Business,Premium Economy,London to Mumbai,February 2017,no,Boeing 777
"""dreadful, stressful experience""",2,Ken Wilkins,24th February 2017,"✅ Verified Review |  San Jose Costa Rica to London Gatwick. We were firstly unable to get two seats together at online check-in. The next day at the airport we asked the clerk if we could have our seats together and he refused. I argued my case that we had paid a lot of money for these flights. After about ten minutes he showed the seating plan to his supervisor who immediately approved changing us to be seated together. I later found out the two BA employees, travelling either for free or at a drastically reduced rate had been given the seats originally and were eventually, after a great deal of argument moved. I have complained to BA and they have confirmed that this did indeed happen and will ensure it doesn't in the future. Next up we both had salmon and were both ill towards the end of the flight. My IFE didnt work, they offered to move me, ironically to swap with one of the BA employees but I declined as it defeated the object of wanting to sit with my wife. Choice of starter also not available but that was no big deal. Dreadful, stressful experience for people who'd paid a lot of money. Have been called by Customer Service who have offered us 10000 Avios as compensation, enough for a night at the Holiday Inn Express! Awful company to deal with, totally dismissive of customer need. On the plus side Business Class seats were comfortable and cabin crew attentive. BA need to do better though, far better if they are to compete with the good Middle East and Far Eastern airlines.",Solo Leisure,Premium Economy,Toronto to London,February 2017,no,Boeing 787-8 / 787-9
"""no better than no frills competitors""",1,Peter Hill,21st February 2017,"✅ Verified Review |  London Heathrow to Stuttgart. Fly in comfort and style is the slogan of British Airways, but there is not much of either around these days. Not willing to pay an extra £8, I was allocated a middle seat right at the rear. At the gate an announcement was made for volunteers to check in their hand-luggage ""at no extra cost"". Within a minute a burly employee told me I had to check in my cabin bag, saying ""you should not believe what is said on the company's website"". How very true! Some ten other passengers, equally perplexed suffered the same fate. I know there were ten, because another employee kept counting us and saying ""we need ten"". The burly employee was later to be found on the airbridge to make sure that we really did hand over our cabin bags. All in all a demeaning experience. The seat rows are now more tightly packed than before. Although of average slim build, I found the seat a tight fit. Only a few passengers took up the offer to purchase food or drink (the deceptive ""upgrade"" we were sold at the beginning of the year). But still, did not reach the back of the plane until shortly before landing. Not only have the complimentary food and drink disappeared, but also newspapers and priority boarding for those of us who are frequent flyers. On the return journey I noticed part of the reason for this new policy: the Stuttgart ground staff have now been replaced by agency staff. BA is now no better than the no frills competitors, but keeps the facade of a full service airline with full service prices. A loyal customer of many, many years, I will choose their competitors in future.",Business,Business Class,London to Hong Kong,February 2017,yes,Boeing 777
"""flight OK with snack and drink""",8,A Wong,16th February 2017,"✅ Verified Review | Flying British Airways from Paris to London is less convenient as they are the only major airline that has the check in counter located one floor down at basement, but good that on this occasion the business class lounge is relocated to the Cathay Pacific lounge as this caters for long haul passengers. Boarding on time but held in tarmac for half an hour, not BA's fault. The pilot tried to make up time but still failed by a few minutes to have lost the allotted time, so the aircraft parked a mile away with inconvenient stair deplane and coach connection, but good that business passengers are taken away first in a separate car. The flight is OK with snack and drink.",Solo Leisure,Economy Class,Vienna to Los Angeles via London,December 2016,no,A319
"""next time I will fly Ryanair""",2,A Taylor,11th February 2017,"❎ Unverified |  London Heathrow to Innsbruck. I have been a loyal customer of British Airways for 30 years. If ever I had a choice between them and another airline I chose British Airways, but no more. The new food and drink service is appalling. The crew on our flight never made it to the last 8 or so rows, so my children (sat at the back) went thirsty. This was particularly poor as another child had wandered to the back of the plane and vomited copiously everywhere - clearly that is not BA's fault, but it is their fault that I couldn't then get a drink for my children to take their minds off the stench of puke pervading our part of the plane. Next time I will fly Ryanair. I doubt we'll notice any difference.",Solo Leisure,Business Class,Gatwick to Salzburg,January 2017,yes,A320
"""British Airways, you need improve""",4,Peter Maidment,6th February 2017,"❎ Unverified |  Gatwick to Barbados, outbound on 19th January and returning 2nd February. Over many years and travelling to many parts of the world, our last flight was a eye opener to see what bean counters can do to ruin a airlines reputation. Please British Airways, you need improve.",Business,Economy Class,Zurich to London,January 2017,no,Boeing 777
"""dreadful business class experience""",1,S Mullins,31st January 2017,"✅ Verified Review |  Gatwick to Barcelona return, and just dreadful pretty much sums up this British Airways business class experience. Since BA moved to Gatwick south terminal, their new lounge is still not ready. They're currently using the clubrooms and the old Virgin Atlantic lounge, now called the speedbird lounge. Gold card holders and passengers travelling in business or first class use the clubrooms. What a sorry state this lounge was. Full, with limited seating, a forty minute wait for food, no available snacks and empty drinks cabinets. I left as hungry and thirsty as I arrived. No to worry though, British Airways will feed me onboard. Once onboard, for a two hour flight, I was served afternoon tea which consisted of three finger sandwiches, a scone and a really small slice of cake. This meal was completely insufficient. There was one drinks round offered and one top up offered. Given that BA use the smallest glasses possible, coupled with its love of miniature cans of lemonade, you will be thirsty. I found trading up to business class to be completely not worth the extra spend. After being disappointed by the outbound catering my disappointment was set to continue with the exact same afternoon tea meal served on my inbound flight. Staff were indifferent and spent most of their time chatting in galley.",Solo Leisure,First Class,LHR to PHL,January 2017,yes,Boeing 777
"""they have lost absolutely their unique selling points""",2,Gerald Pitcher,26th January 2017,"✅ Verified Review |  The decline of British Airways. My review is primarily on BA Euro Traveller in economy. Up to two years ago one felt good when travelling BA. They were miles ahead of budget airlines. Yes they were a bit more expensive, but one enjoyed reasonable food and beverage, checked in cases of 20kg, all part of the service. Today BA provides no free food or beverage, and require extra payment for check in luggage. Today, within Europe, BA has absolutely no advantage opposite EasyJet, Norwegian, Monarch or even Ryanair. Why should anyone pay extra for BA, they have lost absolutely their unique selling points. Incidentally coming back from Malta to London Gatwick in BA in business class, there is nowhere to hang coats. Previously BA flight attendants always hung them in a cupboard. And now NO CUPBOARDS! Extra seats instead. The Decline and Fall of a once proud BA. In future BA will need to to meet or be cheaper than the budget airlines.",Couple Leisure,Business Class,Gatwick to Tampa,January 2017,no,Boeing 777
"""the aircraft was filthy""",1,D Norman,22nd January 2017,"✅ Verified Review |  Flew British Airways from Miami to London Heathrow on 15th January and the aircraft was filthy in Economy class. Pulled out the tiny TV from under the armrest and there was hair attached. Opened the armrest to retrieve table and the dirt was disgusting, this has been an accumulation over a long period of time. TV didn't work and after 3 hours into a 8.5 hour flight and the attendant trying to re-boot it 3 times I finally asked what could be done. I had paid extra for a seat that had extra leg room (seat 29A) as there is no seat in front and you could stretch right out. There was a seat free in Business class but the Manager on the flight made it clear that he was 'not allowed' to move me. I traveled business class on the outbound flight on 3rd Jan but did not feel that it was value for money. I will stick with Emirates or Virgin in the future as I know the aircraft are clean with good customer service. I logged this complaint onboard at the time but a week later still heard nothing, doesn't surprise me.",Business,Economy Class,LGW to CUN,November 2016,no,A320
"""incompetence and insincerity""",1,Y Li,17th January 2017,"✅ Verified Review |  Shanghai to Zurich via London return, and British Airways is absolutely appalling. I have never experienced such terrible customer service from an airline. I booked two return premium economy seats for my mother and I to go from Shanghai to Zurich via London. On the way there, the flight to Zurich was cancelled due to French strike, not BA's fault so that part is clear. However, they kept the flight on the board until very last minute then told everyone it was cancelled, furthermore, they ran out of hotels to put people up and we wasted about 5 hours (after a 12 hours flight) to go through customs (thank god we can enter visa free unlike a few other passengers), find a hotel, arrange our own transport there and back. So the first leg already left a terrible impression. Then, on the way back to Shanghai, they overbooked business so they pushed business passengers into premium economy and then pushed my elderly mother and I to economy for a 12 hour flight. I booked premium economy for a reason, my mum has health issues and need the room in premium economy, did BA care? No. Told us that we were involuntarily downgraded upon check in but that likely we will still get a seat, then at boarding, told us sorry it's either fly economy now or wait till tomorrow to see if there is a seat. Because I had work the next day, we had no option but to fly and BA ushered us on with the promise that they will put in the fare difference request on my behalf which will be processed asap. Three months down the track, I have yet to see a single cent of fare difference and of course there are no customer service phone numbers/emails to write to, only an impersonal link online for you to submit a reference and compliant to their customer service black hole. Needless to say I will forever boycott BA for its incompetence and insincerity towards a paying customer.",Solo Leisure,Business Class,LHR to HKG,January 2017,no,Boeing 777
"""joined budget airline bunch""",1,J Kovasko,13th January 2017,"✅ Verified Review |  London Heathrow to Prague. I've been commuting to and from work for last six and half years. The only airline that takes me to London Heathrow is British Airways. Sometimes I fly there and back up to two times a week. I do not eat on flights, so I thought BA's decision to charge for food was not gonna upset me too much. However they've managed. I always bring my own good quality tea and a cup and ask crew for some hot water. Drink my tea and go to sleep. To my surprise I am not allowed to get hot water anymore! In fact I am not allowed to get any water on BA shorthaul flight unless I pay (even if I bring my own cup and tea) or unless it's medical emergency, then I could get cup of cold water for free. So not only they didn't lower the fare, but they also sucessfully joined budget airline bunch by charging even for water! To my great regret they are the only airline that takes me to Heathrow so I can't take my custom anywhere else unless I change job. But if I am to fly on holiday, British Airways will not be my chosen carrier ever again.",Family Leisure,Business Class,MIA to LHR,January 2017,no,Boeing 747
"""cabin staff stomp up and down the aisle""",1,C Richards,5th January 2017,"✅ Verified Review |  I've flown this route (Sydney to London) many times with other airlines and British Airways is the worst. They changed our seats during the fuel stop at Singapore - without notice, without explanation. The food was terrible - no fruit or green vegetable to be seen. Cabin staff stomp up and down the aisle attending to premium economy - bumped into numerous times. Toilet locations on board are terrible - those poor people seated right next to the WC door. Paid extra for reserved seats - no confirmation. Inflight entertainment was awful - really, really old movies. This airline trades on some nostalgic image as if they were in the 1950's. Other airlines are far superior. Don't risk it - you'll be disappointed.",Couple Leisure,Economy Class,MAD to YUL via LHR,December 2016,no,Boeing 747
"""offered excellent attentive service""",10,B Davidson,27th December 2016,"✅ Verified Review |  Having read so many negative reviews on this site regarding British Airways and their First Class product I was somewhat concerned as to what the experience would be like on our First Class flight from LHR-SAN on BA273 on their B747-400, I needn't have worried, this flight was excellent on all aspects. Our domestic connecting flight from MAN-LHR was delayed by 2 hours due to fog at LHR, the Captain  came into the Gate area and explained the reasons of the delay and invited questions from any concerned passengers about their connecting flights in LHR. Luckily we had planned 4 hours into our itinerary so the delay caused us no problems, passengers with tight connections at LHR were offered alternative connection options. The Concorde Lounge in LHR T5 BA First Class passengers was superb with professional and courteous staff, we had booked a Cabana and Spa Treatments, both were superb and highly recommended, plan time into your itinerary to enjoy these to the full. The lounge offers A la Carte Dining and the food was excellentpromptly, Champagne and great wines were also available. Onboard the BA747 in the First Cabin we had seats 2A & 2K, these offered great comfort for the 11 hour flight, the seats were made into a bed by the cabin crew when you requested it, I got 6 hours sleep, good quality quilts and pillows helped this. Seats 1A or 1K may have been slightly better for a couple travelling together as they are closer together than 2A 2K, but this is not a negative issue. The meal service was excellent, dine when you want, excellent choice of aperitifs, wines and champagne. The young Cabin Crew offered excellent attentive service in a very professional manner throughout the 11 hour flight. First Class seats offer good privacy, probably centre seats 4EF and 5EF offer the least privacy and therefore I would avoid these where possible. BA First is in a league of it's own and miles ahead of Club, both in the Air and on the Ground! Well done BA, this really was a First Class experience in every meaning of the words.",Solo Leisure,Premium Economy,DXB to YYZ via LHR,December 2016,no,Boeing 787
"""contempt for its customers""",1,N Anderson,21st December 2016,"✅ Verified Review | London Heathrow to Copenhagen. After many horrible experiences on BA, I am convinced this airline has total contempt not only for its customers but even for top tier elite frequent flyers. I am AA Executive Platinum and I am being treated worse than cattle - forced to check in carry-on bag which is within the BA limits on multiple occasions, denied boarding, zero upgrade policy, zero flexibility when being forcefully re-booked (recently I had to pay £300 in addition to an already expensive £400 ticket for a 2 hr EU flight). I live in London and I'm a loyal American Airlines frequent flyer clocking around 200,000 miles a year. I will avoid British Airways even if it means an extra connection, flying a low cost carrier or not flying at all.",Solo Leisure,Economy Class,HKG to LHR,December 2016,yes,A380
